{
  "schema_version": "1.0.0",
  "project": "Discord Badge Archive",
  "last_verified": "2026-08-28",
  "verification_policy": "Official entries are grounded in Discord Help Center, Developer Support, or Developer Documentation sources.",
  "badges": [
    {
      "id": "discord-nitro",
      "name": "Discord Nitro",
      "category": "profile",
      "classification": "common",
      "status": "active",
      "obtainability": "obtainable",
      "description": "Profile badge shown for eligible Nitro subscriptions.",
      "how_to_obtain": "Subscribe to an eligible Discord Nitro plan.",
      "asset": "assets/profile/discord-nitro.svg",
      "primary_source": "https://support.discord.com/hc/en-us/articles/360035962891-Profile-Badges-101",
      "source_type": "official",
      "last_verified": "2026-08-28",
      "notes": [
        "Eligible Nitro subscriptions can receive an evolving version; Nitro Basic and Classic do not receive the evolving progression."
      ]
    },
    {
      "id": "server-booster",
      "name": "Server Booster",
      "category": "profile",
      "classification": "common",
      "status": "active",
      "obtainability": "obtainable",
      "description": "Profile badge for users actively boosting one or more servers.",
      "how_to_obtain": "Actively boost a Discord server.",
      "asset": "assets/profile/server-booster.svg",
      "primary_source": "https://support.discord.com/hc/en-us/articles/360035962891-Profile-Badges-101",
      "source_type": "official",
      "last_verified": "2026-08-28",
      "notes": [
        "The design evolves with an uninterrupted boosting streak."
      ]
    },
    {
      "id": "discord-quests",
      "name": "Discord Quests",
      "category": "profile",
      "classification": "common",
      "status": "active",
      "obtainability": "obtainable",
      "description": "Profile badge awarded after completing an eligible Discord Quest.",
      "how_to_obtain": "Complete an eligible Quest.",
      "asset": "assets/profile/discord-quests.svg",
      "primary_source": "https://support.discord.com/hc/en-us/articles/22225719947543-Discord-Quests-FAQ",
      "source_type": "official",
      "last_verified": "2026-08-28",
      "notes": [
        "Discord states that Quest completions before April 24, 2024 do not retroactively grant the badge."
      ]
    },
    {
      "id": "orbs",
      "name": "Orbs",
      "category": "profile",
      "classification": "common",
      "status": "active",
      "obtainability": "obtainable",
      "description": "Profile badge available through the Orbs shop.",
      "how_to_obtain": "Purchase the badge with Orbs in the Orbs shop.",
      "asset": "assets/profile/orbs.svg",
      "primary_source": "https://support.discord.com/hc/en-us/articles/360035962891-Profile-Badges-101",
      "source_type": "official",
      "last_verified": "2026-08-28",
      "notes": [
        "Discord states the badge cannot currently be removed after purchase."
      ]
    },
    {
      "id": "legacy-username",
      "name": "Legacy Username",
      "category": "profile",
      "classification": "common",
      "status": "active",
      "obtainability": "limited",
      "description": "Indicates an eligible account that retained its old username and discriminator information after Discord's username transition.",
      "how_to_obtain": "Available only to eligible accounts from the legacy username system.",
      "asset": "assets/profile/legacy-username.svg",
      "primary_source": "https://support.discord.com/hc/en-us/articles/360035962891-Profile-Badges-101",
      "source_type": "official",
      "last_verified": "2026-08-28",
      "notes": [
        "Eligible users can disable the badge from profile settings."
      ]
    },
    {
      "id": "bug-hunter",
      "name": "Bug Hunter",
      "category": "profile",
      "classification": "rare",
      "status": "active",
      "obtainability": "program",
      "description": "Recognition for highly active members of the Discord Testers bug-hunting community.",
      "how_to_obtain": "Participate actively in the Discord Testers community and meet its recognition criteria.",
      "asset": "assets/profile/bug-hunter.svg",
      "primary_source": "https://support.discord.com/hc/en-us/articles/360035962891-Profile-Badges-101",
      "source_type": "official",
      "last_verified": "2026-08-28",
      "notes": []
    },
    {
      "id": "golden-bug-hunter",
      "name": "Golden Bug Hunter",
      "category": "profile",
      "classification": "rare",
      "status": "active",
      "obtainability": "program",
      "description": "Higher-level Bug Hunter recognition for exceptional contributors in Discord Testers.",
      "how_to_obtain": "Reach the highest Bug Hunter level through exceptional participation in Discord Testers.",
      "asset": "assets/profile/golden-bug-hunter.svg",
      "primary_source": "https://support.discord.com/hc/en-us/articles/360035962891-Profile-Badges-101",
      "source_type": "official",
      "last_verified": "2026-08-28",
      "notes": []
    },
    {
      "id": "discord-staff",
      "name": "Discord Staff",
      "category": "profile",
      "classification": "mythic",
      "status": "active",
      "obtainability": "restricted",
      "description": "Profile badge identifying members of Discord staff.",
      "how_to_obtain": "Reserved for Discord employees.",
      "asset": "assets/profile/discord-staff.svg",
      "primary_source": "https://support.discord.com/hc/en-us/articles/360035962891-Profile-Badges-101",
      "source_type": "official",
      "last_verified": "2026-08-28",
      "notes": []
    },
    {
      "id": "gifting",
      "name": "Gifting",
      "category": "experimental",
      "classification": "experimental",
      "status": "experimental",
      "obtainability": "selected-users",
      "description": "Experimental evolving badge related to Nitro and Shop gifting activity.",
      "how_to_obtain": "Currently available only to selected users in Discord's experiment.",
      "asset": "assets/experimental/gifting.svg",
      "primary_source": "https://support.discord.com/hc/en-us/articles/360035962891-Profile-Badges-101",
      "source_type": "official",
      "last_verified": "2026-08-28",
      "notes": []
    },
    {
      "id": "account-age",
      "name": "Account Age",
      "category": "experimental",
      "classification": "experimental",
      "status": "experimental",
      "obtainability": "selected-users",
      "description": "Experimental profile badge related to account age.",
      "how_to_obtain": "Currently available only to a small subset of desktop users.",
      "asset": "assets/experimental/account-age.svg",
      "primary_source": "https://support.discord.com/hc/en-us/articles/360035962891-Profile-Badges-101",
      "source_type": "official",
      "last_verified": "2026-08-28",
      "notes": []
    },
    {
      "id": "streaming",
      "name": "Streaming",
      "category": "experimental",
      "classification": "experimental",
      "status": "experimental",
      "obtainability": "selected-users",
      "description": "Experimental profile badge related to streaming activity.",
      "how_to_obtain": "Currently available only to a small subset of desktop users.",
      "asset": "assets/experimental/streaming.svg",
      "primary_source": "https://support.discord.com/hc/en-us/articles/360035962891-Profile-Badges-101",
      "source_type": "official",
      "last_verified": "2026-08-28",
      "notes": []
    },
    {
      "id": "game-time",
      "name": "Game Time",
      "category": "experimental",
      "classification": "experimental",
      "status": "experimental",
      "obtainability": "selected-users",
      "description": "Experimental profile badge related to game-time activity.",
      "how_to_obtain": "Currently available only to a small subset of desktop users.",
      "asset": "assets/experimental/game-time.svg",
      "primary_source": "https://support.discord.com/hc/en-us/articles/360035962891-Profile-Badges-101",
      "source_type": "official",
      "last_verified": "2026-08-28",
      "notes": []
    },
    {
      "id": "game-variety",
      "name": "Game Variety",
      "category": "experimental",
      "classification": "experimental",
      "status": "experimental",
      "obtainability": "selected-users",
      "description": "Experimental profile badge related to the variety of games played.",
      "how_to_obtain": "Currently available only to a small subset of desktop users.",
      "asset": "assets/experimental/game-variety.svg",
      "primary_source": "https://support.discord.com/hc/en-us/articles/360035962891-Profile-Badges-101",
      "source_type": "official",
      "last_verified": "2026-08-28",
      "notes": []
    },
    {
      "id": "hypesquad-events",
      "name": "HypeSquad Events",
      "category": "legacy",
      "classification": "legacy",
      "status": "legacy",
      "obtainability": "unobtainable",
      "description": "Historical badge for members who represented Discord through HypeSquad Events.",
      "how_to_obtain": "No longer obtainable.",
      "asset": "assets/legacy/hypesquad-events.svg",
      "primary_source": "https://support.discord.com/hc/en-us/articles/360035962891-Profile-Badges-101",
      "source_type": "official",
      "last_verified": "2026-08-28",
      "notes": []
    },
    {
      "id": "hypesquad-bravery",
      "name": "HypeSquad Bravery",
      "category": "legacy",
      "classification": "legacy",
      "status": "legacy",
      "obtainability": "unobtainable",
      "description": "One of the former HypeSquad House profile badges.",
      "how_to_obtain": "No longer obtainable.",
      "asset": "assets/legacy/hypesquad-bravery.svg",
      "primary_source": "https://support.discord.com/hc/en-us/articles/360035962891-Profile-Badges-101",
      "source_type": "official",
      "last_verified": "2026-08-28",